{
  "applicability": {
    "applied": [
      "solution-architecture",
      "data-model-design"
    ],
    "could_not_determine": [],
    "skipped": []
  },
  "artifacts_produced": [
    {
      "path": ".workbench/work/WB-20260917-CLAUDE-OPTIMIZATION-LOOP/artifacts/implementation-and-verification.md",
      "record_id": "ART-CLAUDE-OPT-LOOP-DESIGN",
      "record_type": "artifact"
    }
  ],
  "authorization_ids": [],
  "created_at": "2026-09-17T23:12:41Z",
  "decisions_required": [],
  "findings": [
    {
      "basis": "fact",
      "source_references": [
        {
          "record_id": "ART-CLAUDE-OPT-LOOP-DESIGN",
          "record_type": "artifact"
        }
      ],
      "statement": "The implemented architecture injects runner, evaluator, and improver interfaces while keeping campaign orchestration and promotion deterministic."
    },
    {
      "basis": "fact",
      "source_references": [
        {
          "record_id": "ART-CLAUDE-OPT-LOOP-DESIGN",
          "record_type": "artifact"
        }
      ],
      "statement": "Filesystem persistence is append-only or immutable for evidence and atomic for state; no database schema or application data model changes."
    }
  ],
  "handoff_id": "HO-CLAUDE-OPT-LOOP-DESIGN",
  "idempotency_key": "claude-opt-loop:design:v1",
  "input_fingerprint": {
    "algorithm": "sha256",
    "value": "42fc53ee83e49c26cbafc4b2c10c943a8637210a4d0c81c81c81ab31b5eacf1d"
  },
  "inputs_used": [
    {
      "record_id": "ART-CLAUDE-OPT-LOOP-DISCOVERY",
      "record_type": "artifact"
    }
  ],
  "node_id": "O-20260917-CLAUDE-OPTIMIZATION-LOOP",
  "node_updates": [],
  "options": [],
  "owner": {
    "actor_id": "agent:workbench",
    "kind": "agent"
  },
  "policy_versions": {
    "workbench": "0.5.0"
  },
  "record_type": "workbench-handoff",
  "schema_version": "0.5.0",
  "specialist": "workbench-coordinator",
  "stage": "data-model-design",
  "status": "completed",
  "suggested_next_stage": "standards-resolution",
  "uncertainties": [],
  "why_next": "Bind the architecture to executable contracts, safety limits, promotion rules, and verification scenarios.",
  "work_id": "WB-20260917-CLAUDE-OPTIMIZATION-LOOP"
}
