{
  "applicability": {
    "applied": [
      "delivery-planning"
    ],
    "could_not_determine": [],
    "skipped": []
  },
  "artifacts_produced": [
    {
      "path": ".workbench/work/WB-20260916-CLAUDE-PARITY-LIVE-RUNNER/artifacts/implementation-authorization-v2.md",
      "record_id": "ART-CLAUDE-PARITY-LIVE-RUNNER-AUTH-V2",
      "record_type": "artifact"
    }
  ],
  "authorization_ids": [
    "AUTH-CLAUDE-PARITY-LIVE-RUNNER-IMPL-V2"
  ],
  "created_at": "2026-09-17T00:55:50Z",
  "decisions_required": [],
  "findings": [
    {
      "basis": "fact",
      "source_references": [
        {
          "record_id": "ART-CLAUDE-PARITY-LIVE-RUNNER-AUTH-V2",
          "record_type": "artifact"
        }
      ],
      "statement": "The corrected current-time grant authorizes local repository and Docker implementation while model use, credentials, spend, global promotion, commit, deployment, publication, and closure remain excluded."
    }
  ],
  "handoff_id": "HO-CLAUDE-PARITY-LIVE-RUNNER-AUTH-V2",
  "idempotency_key": "claude-parity-live-runner:auth:v2",
  "input_fingerprint": {
    "algorithm": "sha256",
    "value": "522c188c832432a4b1b5496501a76384cd9607c263e3541a59b548ebc268bb44"
  },
  "inputs_used": [
    {
      "record_id": "ART-CLAUDE-PARITY-LIVE-RUNNER-PLAN",
      "record_type": "artifact"
    }
  ],
  "node_id": "O-20260916-CLAUDE-PARITY-LIVE-RUNNER",
  "node_updates": [],
  "options": [],
  "owner": {
    "actor_id": "agent:workbench",
    "kind": "agent"
  },
  "policy_versions": {
    "workbench": "0.5.0"
  },
  "record_type": "workbench-handoff",
  "schema_version": "0.5.0",
  "specialist": "workbench-coordinator",
  "stage": "delivery-planning",
  "status": "completed",
  "suggested_next_stage": "implementation",
  "uncertainties": [],
  "why_next": "Proceed under the corrected in-scope implementation grant.",
  "work_id": "WB-20260916-CLAUDE-PARITY-LIVE-RUNNER"
}
