{
  "applicability": {
    "applied": [
      "delivery-planning"
    ],
    "could_not_determine": [],
    "skipped": []
  },
  "artifacts_produced": [
    {
      "path": ".workbench/work/WB-20260916-CLAUDE-INSTRUCTION-OPTIMIZATION/artifacts/pre-post-results.md",
      "record_id": "ART-CLAUDE-INSTRUCTION-OPTIMIZATION-AUTH",
      "record_type": "artifact"
    }
  ],
  "authorization_ids": [
    "AUTH-CLAUDE-INSTRUCTION-OPTIMIZATION-IMPLEMENT"
  ],
  "created_at": "2026-09-17T03:04:54Z",
  "decisions_required": [],
  "findings": [],
  "handoff_id": "HO-CLAUDE-INSTRUCTION-OPTIMIZATION-IMPLEMENT-AUTH",
  "idempotency_key": "claude-instruction-optimization:implementation-auth:v1",
  "input_fingerprint": {
    "algorithm": "sha256",
    "value": "d6be7ca34168ebe428b59653180dc92340007f1f81a378bda82ffc0e8be2060b"
  },
  "inputs_used": [
    {
      "record_id": "ART-CLAUDE-INSTRUCTION-OPTIMIZATION-PLAN",
      "record_type": "artifact"
    }
  ],
  "node_id": "O-20260916-CLAUDE-INSTRUCTION-OPTIMIZATION",
  "node_updates": [],
  "options": [],
  "owner": {
    "actor_id": "agent:workbench",
    "kind": "agent"
  },
  "policy_versions": {
    "workbench": "0.5.0"
  },
  "record_type": "workbench-handoff",
  "schema_version": "0.5.0",
  "specialist": "workbench-coordinator",
  "stage": "delivery-planning",
  "status": "completed",
  "suggested_next_stage": "implementation",
  "uncertainties": [],
  "why_next": "The user's explicit start, full-access, global-file, hook, and repeated-iteration directions authorize the bounded implementation already performed.",
  "work_id": "WB-20260916-CLAUDE-INSTRUCTION-OPTIMIZATION"
}
