{
  "applicability": {
    "applied": [
      "brownfield-reconnaissance"
    ],
    "could_not_determine": [],
    "skipped": []
  },
  "artifacts_produced": [
    {
      "path": ".workbench/work/WB-20260916-WORKBENCH-EVIDENCE-GUARDS/artifacts/reconnaissance.md",
      "record_id": "ART-WEG-RECON",
      "record_type": "artifact"
    }
  ],
  "authorization_ids": [],
  "created_at": "2026-09-16T21:34:08.9026796Z",
  "decisions_required": [],
  "findings": [
    "The existing projection auto-promotes every string finding; compatibility can be preserved by accepting legacy strings as non-established while typed sourced facts and measurements use the established path."
  ],
  "handoff_id": "HO-WEG-RECON",
  "idempotency_key": "workbench-evidence-guards:recon-handoff:v1",
  "input_fingerprint": {
    "algorithm": "sha256",
    "value": "3b0242a026f1abcb942d50a33749f37a7e7d016ca8e357cc95e670bf07c32940"
  },
  "inputs_used": [
    {
      "record_id": "ART-WEG-FRAME",
      "record_type": "artifact"
    }
  ],
  "node_id": "O-20260916-WORKBENCH-EVIDENCE-GUARDS",
  "node_updates": [],
  "options": [],
  "owner": {
    "actor_id": "agent:workbench",
    "kind": "agent"
  },
  "policy_versions": {
    "workbench": "0.5.0"
  },
  "record_type": "workbench-handoff",
  "schema_version": "0.5.0",
  "specialist": "workbench-runtime",
  "stage": "brownfield-reconnaissance",
  "status": "completed",
  "suggested_next_stage": "data-model-design",
  "uncertainties": [],
  "why_next": "Define typed finding semantics and compatibility before changing the projection.",
  "work_id": "WB-20260916-WORKBENCH-EVIDENCE-GUARDS"
}
