{
  "applicability": {
    "applied": [
      "delivery-planning"
    ],
    "could_not_determine": [],
    "skipped": []
  },
  "artifacts_produced": [
    {
      "path": ".workbench/work/WB-20260917-CLAUDE-OPTIMIZATION-LOOP/artifacts/implementation-and-verification.md",
      "record_id": "ART-CLAUDE-OPT-LOOP-AUTH",
      "record_type": "artifact"
    }
  ],
  "authorization_ids": [
    "AUTH-CLAUDE-OPT-LOOP-IMPLEMENT"
  ],
  "created_at": "2026-09-17T23:12:41Z",
  "decisions_required": [],
  "findings": [],
  "handoff_id": "HO-CLAUDE-OPT-LOOP-IMPLEMENT-AUTH",
  "idempotency_key": "claude-opt-loop:implementation-auth:v1",
  "input_fingerprint": {
    "algorithm": "sha256",
    "value": "860a4b42338d1c2517e8d329323d545fe042097d8ebb7b709c89397d9a410e84"
  },
  "inputs_used": [
    {
      "record_id": "ART-CLAUDE-OPT-LOOP-PLAN",
      "record_type": "artifact"
    }
  ],
  "node_id": "O-20260917-CLAUDE-OPTIMIZATION-LOOP",
  "node_updates": [],
  "options": [],
  "owner": {
    "actor_id": "agent:workbench",
    "kind": "agent"
  },
  "policy_versions": {
    "workbench": "0.5.0"
  },
  "record_type": "workbench-handoff",
  "schema_version": "0.5.0",
  "specialist": "workbench-coordinator",
  "stage": "delivery-planning",
  "status": "completed",
  "suggested_next_stage": "implementation",
  "uncertainties": [],
  "why_next": "The user's explicit 'do it' instruction authorizes the bounded repository implementation while paid provider runs, global installation, commit, deployment, and closure remain withheld.",
  "work_id": "WB-20260917-CLAUDE-OPTIMIZATION-LOOP"
}
