{
  "applicability": {
    "applied": [
      "solution-architecture"
    ],
    "could_not_determine": [],
    "skipped": [
      {
        "method_id": "experience-design",
        "reason": "No human-facing UI is part of the initial CLI suite."
      },
      {
        "method_id": "data-model-design",
        "reason": "The suite has no database or durable application-data model."
      },
      {
        "method_id": "proposal",
        "reason": "The user already authorized implementation and no proceed decision remains."
      }
    ]
  },
  "artifacts_produced": [
    {
      "path": ".workbench/work/WB-20260916-CLAUDE-HARNESS-EVALS/artifacts/architecture.md",
      "record_id": "ART-CLAUDE-HARNESS-EVALS-ARCH",
      "record_type": "artifact"
    }
  ],
  "authorization_ids": [],
  "created_at": "2026-09-16T22:25:38.983837Z",
  "decisions_required": [],
  "findings": [
    {
      "basis": "inference",
      "source_references": [
        {
          "record_id": "ART-CLAUDE-HARNESS-EVALS-DISCOVER",
          "record_type": "artifact"
        }
      ],
      "statement": "An immutable typed catalog plus an isolated stage/verify CLI preserves evaluator secrecy with less fixture sprawl than four physical evaluator files per task."
    },
    {
      "basis": "fact",
      "source_references": [
        {
          "record_id": "ART-CLAUDE-HARNESS-EVALS-DISCOVER",
          "record_type": "artifact"
        }
      ],
      "statement": "Filesystem separation protects evaluator assets from ordinary agent access but does not constitute an operating-system sandbox for executing untrusted candidate code."
    }
  ],
  "handoff_id": "HO-CLAUDE-HARNESS-EVALS-ARCH",
  "idempotency_key": "claude-harness-evals:architecture-handoff:v1",
  "input_fingerprint": {
    "algorithm": "sha256",
    "value": "eb96a7e565bdca7ef61eb14def4abada26f55c3c557347078cf85b3d4c28719f"
  },
  "inputs_used": [
    {
      "record_id": "ART-CLAUDE-HARNESS-EVALS-DISCOVER",
      "record_type": "artifact"
    }
  ],
  "node_id": "O-20260916-CLAUDE-HARNESS-EVALS",
  "node_updates": [],
  "options": [],
  "owner": {
    "actor_id": "agent:workbench",
    "kind": "agent"
  },
  "policy_versions": {
    "workbench": "0.5.0"
  },
  "record_type": "workbench-handoff",
  "schema_version": "0.5.0",
  "specialist": "solution-architecture",
  "stage": "solution-architecture",
  "status": "completed",
  "suggested_next_stage": "delivery-planning",
  "uncertainties": [],
  "why_next": "Specify the task catalog, runner contract, TDD slices, and acceptance matrix before implementation.",
  "work_id": "WB-20260916-CLAUDE-HARNESS-EVALS"
}
