{
  "applicability": {
    "applied": [
      "brownfield-reconnaissance"
    ],
    "could_not_determine": [],
    "skipped": []
  },
  "artifacts_produced": [
    {
      "path": ".workbench/work/WB-20260916-CLAUDE-PARITY-IMPLEMENTATION/artifacts/reconnaissance.md",
      "record_id": "ART-CLAUDE-PARITY-IMPL-RECON",
      "record_type": "artifact"
    }
  ],
  "authorization_ids": [],
  "created_at": "2026-09-16T23:50:00Z",
  "decisions_required": [],
  "findings": [
    {
      "basis": "fact",
      "source_references": [
        {
          "record_id": "ART-CLAUDE-PARITY-IMPL-RECON",
          "record_type": "artifact"
        }
      ],
      "statement": "The controller can extend the existing standard-library CLI through a new experiment package while preserving every current command."
    }
  ],
  "handoff_id": "HO-CLAUDE-PARITY-IMPL-RECON",
  "idempotency_key": "claude-parity-implementation:recon:v1",
  "input_fingerprint": {
    "algorithm": "sha256",
    "value": "19fa36f18907cb363ba392b84e9c02bad0cf7af6653e215c1210c5a527ddcb67"
  },
  "inputs_used": [
    {
      "record_id": "ART-CLAUDE-PARITY-IMPL-FRAME",
      "record_type": "artifact"
    }
  ],
  "node_id": "O-20260916-CLAUDE-PARITY-IMPLEMENTATION",
  "node_updates": [],
  "options": [],
  "owner": {
    "actor_id": "agent:workbench",
    "kind": "agent"
  },
  "policy_versions": {
    "workbench": "0.5.0"
  },
  "record_type": "workbench-handoff",
  "schema_version": "0.5.0",
  "specialist": "workbench-coordinator",
  "stage": "brownfield-reconnaissance",
  "status": "completed",
  "suggested_next_stage": "data-model-design",
  "uncertainties": [],
  "why_next": "Proceed to data-model-design under the accepted predecessor plan.",
  "work_id": "WB-20260916-CLAUDE-PARITY-IMPLEMENTATION"
}
